{
  "schema_version": "1.0",
  "id": "acceptance-object-links-routes-6fec815-20260803",
  "candidate_id": "object-links-routes-6fec815-20260803",
  "status": "blocked",
  "gate_results": {
    "format": {
      "status": "passed",
      "details": "gofmt, git diff --check, and complete frontend Prettier passed on source 6fec81522f4e74ce4a7aa872195068034d349fd7"
    },
    "static_analysis": {
      "status": "passed",
      "details": "go vet ./... and frontend ESLint completed with zero errors"
    },
    "unit": {
      "status": "passed",
      "details": "go test ./... passed after the immutable prebuilt installer change"
    },
    "contract": {
      "status": "passed",
      "details": "REST, MCP, event, compatibility, and eight built-in template contracts passed; contract sha256:3eaffde190cf88ab4db67a6d273d1fc336383865898d0fc9630277f3710adbc0"
    },
    "frontend": {
      "status": "passed",
      "details": "59 Vitest files and 199 tests passed; production SPA and embedded asset build passed"
    },
    "privileged_integration": {
      "status": "blocked",
      "reason": "local privileged Docker dual-stack, object-link path, capture/filter, recovery, race, and leak gates passed; deployment and target-host acceptance are pending"
    },
    "recovery": {
      "status": "passed",
      "details": "service recovery, interrupted object-link deletion, namespace adoption, and host-policy tests passed locally"
    },
    "security": {
      "status": "passed",
      "details": "shell-vector, export redaction, evidence hygiene, systemd bounds, and immutable prebuilt deployment tests passed"
    },
    "leak": {
      "status": "passed",
      "details": "100-cycle object-link, capture/filter, and managed-route ownership cleanup gate passed locally"
    },
    "browser": {
      "status": "passed",
      "details": "local Playwright passed 62 tests in desktop and minimum viewports; 24 runtime or target-only cases were capability-gated with no failures"
    },
    "candidate_artifact": {
      "status": "passed",
      "details": "source=6fec81522f4e74ce4a7aa872195068034d349fd7; archive=sha256:496567e1a01a184b880fc59e73a4bacb0519af9c18bcc1ef2a7e14fd986528a0; binary=sha256:296aeae2e509820f7a9299ad218977e6413a128d87358953ba8509d97a7d193b; built_at=2026-08-03T11:11:00Z"
    },
    "migration_and_rollback": {
      "status": "passed",
      "details": "target schema migrations 1-6 will advance through 12; predeployment binary sha256:8f91a35e246ba575d313912d534bbe6932e1dc286bf4454fce039b026f5d9480; rollback database sha256:63a2586c44f2c5651df624247993bdb68399f2eff66151ef574753fa9f353aa1; rollback artifacts are stored under /var/lib/netlab/backups"
    }
  },
  "scenario_evidence_ids": [
    "local-object-link-route-gate-20260803",
    "local-browser-dual-viewport-20260803",
    "target-predeployment-backup-20260803"
  ],
  "exceptions": [],
  "cleanup_baseline": {
    "digest": "sha256:c3c71c7534047234c183db68e7a49b8ff08ba69e6cd875119da4b91bb23863e1",
    "resources": {
      "qemu_runtime_directories": 1,
      "nat_runtime_directories": 0,
      "capture_files": 1,
      "network_namespaces": 3,
      "owned_links": 64,
      "runtime_ownership_records": 35,
      "unknown_ownership_records": 20
    }
  },
  "cleanup_final": {
    "digest": "sha256:c3c71c7534047234c183db68e7a49b8ff08ba69e6cd875119da4b91bb23863e1",
    "resources": {
      "qemu_runtime_directories": 1,
      "nat_runtime_directories": 0,
      "capture_files": 1,
      "network_namespaces": 3,
      "owned_links": 64,
      "runtime_ownership_records": 35,
      "unknown_ownership_records": 20
    }
  },
  "redaction_result": {
    "passed": true,
    "prohibited_content_count": 0
  },
  "conclusion": "blocked",
  "started_at": "2026-08-03T11:11:00Z",
  "finished_at": "2026-08-03T11:13:37Z"
}
